<?xml version="1.0"?>
<xs:schema xmlns:xs="http://www.w3.org/2001/XMLSchema">
    <xs:element name="vehiculos">
        <xs:complexType>
            <xs:sequence>
                <xs:element name="vehiculo" maxOccurs="unbounded">
                    <xs:complexType>
                        <xs:sequence>
                            <xs:element name="marca">
                                <xs:simpleType>
                                    <xs:restriction base="xs:string">
                                        <xs:pattern value="[a-zA-Z0-9]*"/>
                                        <xs:maxLength value="10"/>
                                    </xs:restriction>
                                </xs:simpleType>
                            </xs:element>
                            <xs:element name="modelo">
                                <xs:simpleType>
                                    <xs:restriction base="xs:string">
                                        <xs:pattern value="[a-zA-Z0-9]*"/>
                                        <xs:maxLength value="20"/>
                                    </xs:restriction>
                                </xs:simpleType>
                            </xs:element>
                            <xs:element name="matricula">
                                <xs:simpleType>
                                    <xs:restriction base="xs:string">
                                        <xs:pattern value="[0-9][0-9][0-9][0-9][-][A-Z][A-Z][A-Z]"/>
                                    </xs:restriction>
                                </xs:simpleType>
                            </xs:element>
                            <xs:element name="puertas">
                                <xs:simpleType>
                                    <xs:restriction base="xs:integer">
                                        <xs:enumeration value="0"/>
                                        <xs:enumeration value="2"/>
                                        <xs:enumeration value="3"/>
                                        <xs:enumeration value="5"/>
                                    </xs:restriction>
                                </xs:simpleType>
                            </xs:element>
                            <xs:element name="foto">
                                <xs:simpleType>
                                    <xs:restriction base="xs:string">
                                        <xs:pattern value="http[s]*://[^~,]*"/>
                                    </xs:restriction>
                                </xs:simpleType>
                            </xs:element>
                            <xs:element name="color" type="xs:string"/>
                            <xs:element name="tipo">
                                <xs:simpleType>
                                    <xs:restriction base="xs:string">
                                        <xs:enumeration value="Coche"/>
                                        <xs:enumeration value="Moto"/>
                                        <xs:enumeration value="CamiÃ³n"/>
                                    </xs:restriction>
                                </xs:simpleType>
                            </xs:element>
                            <xs:element name="precio" type="xs:double"/>
                            <xs:element name="comentario">
                                <xs:simpleType>
                                    <xs:restriction base="xs:string">
                                        <xs:maxLength value="50"/>
                                    </xs:restriction>
                                </xs:simpleType>
                            </xs:element>
                        </xs:sequence>
                    </xs:complexType>
                </xs:element>
            </xs:sequence>
        </xs:complexType>
    </xs:element>
</xs:schema>